{
  "schema": "nudge-designer.intent/v1",
  "id": "I-GRADE11",
  "revision": 1,
  "owner_request": "Help a Grade 11 learner distinguish instantaneous velocity from acceleration and transfer the idea to a new motion problem.",
  "purpose": "Help a Grade 11 learner distinguish instantaneous velocity from acceleration and transfer the idea to a new motion problem.",
  "sources": [
    {"id": "S-TEACHER", "locator": "case.md", "revision": null, "kind": "SYNTHETIC", "assessment": "SUPPLIED", "note": "Synthetic Grade 11 kinematics brief; no board syllabus or real learner assessment supplied."}
  ],
  "items": [
    {"id": "R-LEARN", "kind": "REQUIREMENT", "text": "Teach and assess the velocity/acceleration distinction, not formula copying.", "source_refs": ["S-TEACHER"], "condition": null, "state": "CURRENT", "outcome_refs": []},
    {"id": "C-PHYSICS", "kind": "CONSTRAINT", "text": "Use the declared one-dimensional constant-gravity model and explicit signs/units.", "source_refs": ["S-TEACHER"], "condition": "For this example only: upward positive, g=10 m/s^2, no drag.", "state": "CURRENT", "outcome_refs": []},
    {"id": "C-CLAIMS", "kind": "CONSTRAINT", "text": "Do not claim learning gains without actual learner evidence.", "source_refs": ["S-TEACHER"], "condition": null, "state": "CURRENT", "outcome_refs": []},
    {"id": "F-PREREQ", "kind": "FACT", "text": "The synthetic learner knows displacement and velocity but confuses zero velocity with zero acceleration.", "source_refs": ["S-TEACHER"], "condition": null, "state": "CURRENT", "outcome_refs": ["O-CONTENT"]},
    {"id": "U-RESPONSE", "kind": "UNKNOWN", "text": "No actual learner explanation, transfer response or delayed retrieval is available.", "source_refs": [], "condition": null, "state": "UNRESOLVED", "outcome_refs": ["O-LEARNING"]}
  ],
  "outcomes": [
    {"id": "O-CONTENT", "parent_id": null, "text": "Create correct scaffolded material.", "done_when": "Worked reasoning, misconception contrast and meaningful transfer assessment.", "item_refs": ["R-LEARN", "F-PREREQ"]},
    {"id": "O-LEARNING", "parent_id": "O-CONTENT", "text": "Assess actual understanding separately.", "done_when": "Learner explains and solves a new case without copied steps.", "item_refs": ["R-LEARN"]}
  ],
  "knowledge": [
    {"topic": "Instantaneous quantities, signed acceleration, prerequisites and transfer", "reason": "Needed to interpret the concrete case and its limits.", "outcome_refs": ["O-CONTENT"], "source_refs": ["S-TEACHER"]}
  ],
  "worker": {
    "model": null,
    "reasoning_effort": null,
    "configuration_basis": "UNKNOWN in this example; a runtime must record actual settings and access.",
    "tools": ["Source reader; actual runtime tools must be checked"],
    "reserved_decisions": ["Any new authority, consequential design choice or scope expansion"]
  },
  "scope": {
    "permitted": ["Create and subject-review synthetic lesson material; propose learner checks"],
    "forbidden": ["Invent execution, source authority or acceptance"],
    "basis_refs": ["S-TEACHER"],
    "note": "Supplied example scope; not an authenticated work grant."
  },
  "protocols": {
    "thinking": null,
    "delivery": null,
    "note": "Select thinking and delivery separately from actual project authority; no automatic version substitution."
  }
}
